{
  "baud_rate": null,
  "command_encoding": "jsonl",
  "endpoint": null,
  "hardware_io_enabled": false,
  "limitations": [
    "Transport planning only.",
    "No OpenDrop hardware support is claimed."
  ],
  "protocol_family": "opendrop_arduino_style",
  "requires_explicit_enable": true,
  "transport_config_version": "klein.opendrop_transport_config.v1",
  "transport_kind": "none",
  "untested_hardware_warning": true
}
